{
  "$schema": "http://json-schema.org/draft-07/schema#",
  "$id": "ddalkak/bridge.schema.json",
  "title": "Ddalkak Design Bridge",
  "description": "Figma를 AI 친화 형태로 정규화한 디자인 브릿지. bridge 단계가 산출, plan/code/verify가 소비하는 SSOT.",
  "type": "object",
  "required": ["meta", "screens"],
  "properties": {
    "meta": {
      "type": "object",
      "required": ["figmaUrl", "mode"],
      "properties": {
        "figmaUrl": { "type": "string" },
        "mode": { "enum": ["section", "page"] },
        "extractedAt": { "type": "string" }
      }
    },
    "tokens": {
      "type": "object",
      "properties": {
        "color":   { "type": "object", "additionalProperties": { "type": "string" } },
        "type":    { "type": "object" },
        "spacing": { "type": "object" }
      }
    },
    "screens": {
      "type": "array",
      "items": {
        "type": "object",
        "required": ["name", "nodes"],
        "properties": {
          "name":  { "type": "string" },
          "frame": { "type": "object", "properties": { "w": { "type": "number" }, "h": { "type": "number" } } },
          "nodes": { "type": "array", "items": { "$ref": "#/$defs/node" } }
        }
      }
    },
    "assets": {
      "type": "array",
      "items": {
        "type": "object",
        "properties": {
          "id":     { "type": "string" },
          "export": { "type": "string" }
        }
      }
    }
  },
  "$defs": {
    "node": {
      "type": "object",
      "required": ["type"],
      "properties": {
        "type":     { "enum": ["text", "image", "group", "shape", "component"] },
        "content":  { "type": "string" },
        "ref":      { "type": "string" },
        "layout":   { "type": "string" },
        "gap":      { "type": "number" },
        "style":    { "type": "object" },
        "bbox":     { "type": "array", "items": { "type": "number" } },
        "children": { "type": "array", "items": { "$ref": "#/$defs/node" } }
      }
    }
  }
}
